{
  "result_schema_version": 2,
  "harness_version": "1.0.0",
  "evaluated_at": "2026-10-13T13:00:00+00:00",
  "run_id": "peewee-0002-single-agent-r02-a01",
  "arm": "single-agent",
  "task_id": "peewee-0002",
  "faixa": "media",
  "repetition": 2,
  "base_commit": "fc1811ecc1c55be8b1c4fd116c5d05c4ff7cf794",
  "resolved": true,
  "resolved_blocked_by_cheat": false,
  "oracle": {
    "f2p_total": 6,
    "f2p_passed": 6,
    "f2p": {
      "exit_code": 0,
      "passed": 6,
      "failed": 0,
      "errors": 0,
      "skipped": 0,
      "duration_s": 0.35,
      "failing_node_ids": [],
      "timed_out": false,
      "network_isolated": true
    },
    "p2p": {
      "exit_code": 0,
      "passed": 1404,
      "failed": 0,
      "errors": 0,
      "skipped": 144,
      "duration_s": 4.35,
      "failing_node_ids": [],
      "timed_out": false,
      "network_isolated": true
    },
    "regression": {
      "exit_code": 0,
      "passed": 1404,
      "failed": 0,
      "errors": 0,
      "skipped": 144,
      "duration_s": 4.31,
      "failing_node_ids": [],
      "timed_out": false,
      "network_isolated": true
    }
  },
  "cheat": {
    "clean": true,
    "critical_count": 0,
    "warning_count": 0,
    "signals": []
  },
  "quality": {
    "mi_before": 22.193,
    "mi_after": 21.845,
    "mi_delta": -0.348,
    "cc_mean_before": 2.735,
    "cc_mean_after": 2.749,
    "cc_mean_delta": 0.014,
    "files_analyzed": 5,
    "error": null
  },
  "cost": {
    "tokens_prompt": 2095228,
    "tokens_completion": 13551,
    "tokens_reasoning": 0,
    "tokens_total": 2108779,
    "cost_usd": 0.2277002,
    "llm_calls": 111,
    "byok_calls": 111,
    "tool_calls": 110,
    "wall_seconds": 529.859
  },
  "process": {
    "turns": 111,
    "test_runs": 1,
    "tool_denials": 1,
    "errors": 0,
    "circuit_breaks": 0,
    "self_recoveries": 0,
    "stop_reason": "tests_pass"
  },
  "provenance": {
    "model": "qwen/qwen3-coder",
    "provider_requested": "DeepInfra",
    "providers_served": [
      "DeepInfra"
    ],
    "llm_seed": 20260822,
    "topology": "single_agent"
  },
  "diff": {
    "files_changed": 5,
    "insertions": 55,
    "deletions": 5,
    "changed_files": [
      "peewee.py",
      "peewee_test.db-shm",
      "playhouse/apsw_ext.py",
      "playhouse/cysqlite_ext.py",
      "playhouse/migrate.py",
      "playhouse/reflection.py"
    ]
  }
}
