{
  "result_schema_version": 2,
  "harness_version": "1.0.0",
  "evaluated_at": "2026-10-15T04:22:11+00:00",
  "run_id": "tomlkit-0002-orchestration-r01-a01",
  "arm": "orchestration",
  "task_id": "tomlkit-0002",
  "faixa": "grande",
  "repetition": 1,
  "base_commit": "b5da6c945aa00bf818f89d2fbd434bc3c2c949e2",
  "resolved": true,
  "resolved_blocked_by_cheat": false,
  "oracle": {
    "f2p_total": 1,
    "f2p_passed": 1,
    "f2p": {
      "exit_code": 0,
      "passed": 1,
      "failed": 0,
      "errors": 0,
      "skipped": 0,
      "duration_s": 0.14,
      "failing_node_ids": [],
      "timed_out": false,
      "network_isolated": true
    },
    "p2p": {
      "exit_code": 0,
      "passed": 744,
      "failed": 0,
      "errors": 0,
      "skipped": 0,
      "duration_s": 1.97,
      "failing_node_ids": [],
      "timed_out": false,
      "network_isolated": true
    },
    "regression": {
      "exit_code": 0,
      "passed": 744,
      "failed": 0,
      "errors": 0,
      "skipped": 0,
      "duration_s": 1.98,
      "failing_node_ids": [],
      "timed_out": false,
      "network_isolated": true
    }
  },
  "cheat": {
    "clean": true,
    "critical_count": 0,
    "warning_count": 0,
    "signals": []
  },
  "quality": {
    "mi_before": 22.601,
    "mi_after": 22.268,
    "mi_delta": -0.333,
    "cc_mean_before": 2.831,
    "cc_mean_after": 2.945,
    "cc_mean_delta": 0.114,
    "files_analyzed": 3,
    "error": null
  },
  "cost": {
    "tokens_prompt": 1176430,
    "tokens_completion": 17562,
    "tokens_reasoning": 0,
    "tokens_total": 1193992,
    "cost_usd": 0.1597742,
    "llm_calls": 125,
    "byok_calls": 125,
    "tool_calls": 117,
    "wall_seconds": 655.117
  },
  "process": {
    "turns": 120,
    "test_runs": 4,
    "tool_denials": 0,
    "errors": 0,
    "circuit_breaks": 2,
    "self_recoveries": 0,
    "stop_reason": "budget: max_turns (120 >= 120)"
  },
  "provenance": {
    "model": "qwen/qwen3-coder",
    "provider_requested": "DeepInfra",
    "providers_served": [
      "DeepInfra"
    ],
    "llm_seed": 20260821,
    "topology": "multi_agent_roles"
  },
  "diff": {
    "files_changed": 3,
    "insertions": 83,
    "deletions": 2,
    "changed_files": [
      "tomlkit/api.py",
      "tomlkit/container.py",
      "tomlkit/items.py"
    ]
  }
}
