{
  "result_schema_version": 2,
  "harness_version": "1.0.0",
  "evaluated_at": "2026-10-13T02:30:09+00:00",
  "run_id": "sqlite-utils-0001-orchestration-r01-a01",
  "arm": "orchestration",
  "task_id": "sqlite-utils-0001",
  "faixa": "pequena",
  "repetition": 1,
  "base_commit": "d71420065903ff54247b5062b8c6af6165b7e638",
  "resolved": false,
  "resolved_blocked_by_cheat": false,
  "oracle": {
    "f2p_total": 5,
    "f2p_passed": 5,
    "f2p": {
      "exit_code": 0,
      "passed": 5,
      "failed": 0,
      "errors": 0,
      "skipped": 0,
      "duration_s": 0.1,
      "failing_node_ids": [],
      "timed_out": false,
      "network_isolated": true
    },
    "p2p": {
      "exit_code": 1,
      "passed": 1371,
      "failed": 1,
      "errors": 0,
      "skipped": 16,
      "duration_s": 5.47,
      "failing_node_ids": [
        "tests/test_transform.py::test_transform_in_transaction_allowed_with_foreign_keys_off"
      ],
      "timed_out": false,
      "network_isolated": true
    },
    "regression": {
      "exit_code": 1,
      "passed": 1371,
      "failed": 1,
      "errors": 0,
      "skipped": 16,
      "duration_s": 5.49,
      "failing_node_ids": [
        "tests/test_transform.py::test_transform_in_transaction_allowed_with_foreign_keys_off"
      ],
      "timed_out": false,
      "network_isolated": true
    }
  },
  "cheat": {
    "clean": true,
    "critical_count": 0,
    "warning_count": 0,
    "signals": []
  },
  "quality": {
    "mi_before": 0.0,
    "mi_after": 0.0,
    "mi_delta": 0.0,
    "cc_mean_before": 6.716,
    "cc_mean_after": 6.768,
    "cc_mean_delta": 0.052,
    "files_analyzed": 1,
    "error": null
  },
  "cost": {
    "tokens_prompt": 183615,
    "tokens_completion": 7706,
    "tokens_reasoning": 0,
    "tokens_total": 191321,
    "cost_usd": 0.0285921,
    "llm_calls": 26,
    "byok_calls": 26,
    "tool_calls": 22,
    "wall_seconds": 93.863
  },
  "process": {
    "turns": 23,
    "test_runs": 1,
    "tool_denials": 1,
    "errors": 0,
    "circuit_breaks": 0,
    "self_recoveries": 0,
    "stop_reason": "concluiu"
  },
  "provenance": {
    "model": "qwen/qwen3-coder",
    "provider_requested": "DeepInfra",
    "providers_served": [
      "DeepInfra"
    ],
    "llm_seed": 20260821,
    "topology": "multi_agent_roles"
  },
  "diff": {
    "files_changed": 1,
    "insertions": 37,
    "deletions": 0,
    "changed_files": [
      "sqlite_utils/db.py"
    ]
  }
}
