{
  "result_schema_version": 2,
  "harness_version": "1.0.0",
  "evaluated_at": "2026-10-13T15:25:08+00:00",
  "run_id": "sqlite-utils-0002-single-agent-r02-a01",
  "arm": "single-agent",
  "task_id": "sqlite-utils-0002",
  "faixa": "pequena",
  "repetition": 2,
  "base_commit": "75ba58846206b2c1beb39836134e763bf34177aa",
  "resolved": false,
  "resolved_blocked_by_cheat": false,
  "oracle": {
    "f2p_total": 11,
    "f2p_passed": 5,
    "f2p": {
      "exit_code": 1,
      "passed": 5,
      "failed": 6,
      "errors": 0,
      "skipped": 0,
      "duration_s": 0.18,
      "failing_node_ids": [
        "tests/test_transform.py::test_transform_sql_table_with_no_primary_key[False-params1-expected_sql1]",
        "tests/test_transform.py::test_transform_sql_table_with_no_primary_key[True-params1-expected_sql1]",
        "tests/test_transform.py::test_transform_sql_table_with_primary_key[False-params1-expected_sql1]",
        "tests/test_transform.py::test_transform_sql_table_with_primary_key[False-params4-expected_sql4]",
        "tests/test_transform.py::test_transform_sql_table_with_primary_key[True-params1-expected_sql1]",
        "tests/test_transform.py::test_transform_sql_table_with_primary_key[True-params4-expected_sql4]"
      ],
      "timed_out": false,
      "network_isolated": true
    },
    "p2p": {
      "exit_code": 1,
      "passed": 1482,
      "failed": 6,
      "errors": 0,
      "skipped": 16,
      "duration_s": 5.62,
      "failing_node_ids": [
        "tests/test_transform.py::test_transform_sql_table_with_no_primary_key[False-params1-expected_sql1]",
        "tests/test_transform.py::test_transform_sql_table_with_no_primary_key[True-params1-expected_sql1]",
        "tests/test_transform.py::test_transform_sql_table_with_primary_key[False-params1-expected_sql1]",
        "tests/test_transform.py::test_transform_sql_table_with_primary_key[False-params4-expected_sql4]",
        "tests/test_transform.py::test_transform_sql_table_with_primary_key[True-params1-expected_sql1]",
        "tests/test_transform.py::test_transform_sql_table_with_primary_key[True-params4-expected_sql4]"
      ],
      "timed_out": false,
      "network_isolated": true
    },
    "regression": {
      "exit_code": 1,
      "passed": 1482,
      "failed": 6,
      "errors": 0,
      "skipped": 16,
      "duration_s": 5.52,
      "failing_node_ids": [
        "tests/test_transform.py::test_transform_sql_table_with_no_primary_key[False-params1-expected_sql1]",
        "tests/test_transform.py::test_transform_sql_table_with_no_primary_key[True-params1-expected_sql1]",
        "tests/test_transform.py::test_transform_sql_table_with_primary_key[False-params1-expected_sql1]",
        "tests/test_transform.py::test_transform_sql_table_with_primary_key[False-params4-expected_sql4]",
        "tests/test_transform.py::test_transform_sql_table_with_primary_key[True-params1-expected_sql1]",
        "tests/test_transform.py::test_transform_sql_table_with_primary_key[True-params4-expected_sql4]"
      ],
      "timed_out": false,
      "network_isolated": true
    }
  },
  "cheat": {
    "clean": true,
    "critical_count": 0,
    "warning_count": 0,
    "signals": []
  },
  "quality": {
    "mi_before": 0.0,
    "mi_after": 0.0,
    "mi_delta": 0.0,
    "cc_mean_before": 7.23,
    "cc_mean_after": 7.323,
    "cc_mean_delta": 0.093,
    "files_analyzed": 1,
    "error": null
  },
  "cost": {
    "tokens_prompt": 8063254,
    "tokens_completion": 73086,
    "tokens_reasoning": 0,
    "tokens_total": 8136340,
    "cost_usd": 1.184347,
    "llm_calls": 100,
    "byok_calls": 100,
    "tool_calls": 65,
    "wall_seconds": 2429.656
  },
  "process": {
    "turns": 100,
    "test_runs": 35,
    "tool_denials": 0,
    "errors": 0,
    "circuit_breaks": 1,
    "self_recoveries": 0,
    "stop_reason": "budget: max_tokens (8136340 >= 8000000)"
  },
  "provenance": {
    "model": "qwen/qwen3-coder",
    "provider_requested": "DeepInfra",
    "providers_served": [
      "DeepInfra"
    ],
    "llm_seed": 20260822,
    "topology": "single_agent"
  },
  "diff": {
    "files_changed": 1,
    "insertions": 60,
    "deletions": 9,
    "changed_files": [
      "sqlite_utils/db.py"
    ]
  }
}
