{
  "result_schema_version": 2,
  "harness_version": "1.0.0",
  "evaluated_at": "2026-10-13T13:56:19+00:00",
  "run_id": "peewee-0002-orchestration-r02-a01",
  "arm": "orchestration",
  "task_id": "peewee-0002",
  "faixa": "media",
  "repetition": 2,
  "base_commit": "fc1811ecc1c55be8b1c4fd116c5d05c4ff7cf794",
  "resolved": false,
  "resolved_blocked_by_cheat": false,
  "oracle": {
    "f2p_total": 6,
    "f2p_passed": 2,
    "f2p": {
      "exit_code": 1,
      "passed": 2,
      "failed": 4,
      "errors": 0,
      "skipped": 0,
      "duration_s": 0.89,
      "failing_node_ids": [
        "tests/migrations.py::TestSchemaMigration::test_make_index_name_long",
        "tests/sql.py::TestOnConflictSqlite::test_unbound_error",
        "tests/transactions.py::TestTransaction::test_commit_rollback_closed",
        "tests/transactions.py::TestTransaction::test_mixing_manual_db_context"
      ],
      "timed_out": false,
      "network_isolated": true
    },
    "p2p": {
      "exit_code": 1,
      "passed": 1252,
      "failed": 152,
      "errors": 0,
      "skipped": 144,
      "duration_s": 9.22,
      "failing_node_ids": [
        "tests/dataset.py::TestDataSet::test_case_insensitive",
        "tests/dataset.py::TestDataSet::test_column_preservation",
        "tests/dataset.py::TestDataSet::test_create_index",
        "tests/dataset.py::TestDataSet::test_creating_tables",
        "tests/dataset.py::TestDataSet::test_delete",
        "tests/dataset.py::TestDataSet::test_export",
        "tests/dataset.py::TestDataSet::test_find",
        "tests/dataset.py::TestDataSet::test_foreign_keys",
        "tests/dataset.py::TestDataSet::test_freeze_thaw",
        "tests/dataset.py::TestDataSet::test_freeze_thaw_csv_utf8",
        "tests/dataset.py::TestDataSet::test_freeze_thaw_datatypes_csv",
        "tests/dataset.py::TestDataSet::test_freeze_thaw_datatypes_json",
        "tests/dataset.py::TestDataSet::test_freeze_thaw_json_utf8",
        "tests/dataset.py::TestDataSet::test_freeze_thaw_nulls",
        "tests/dataset.py::TestDataSet::test_import_csv",
        "tests/dataset.py::TestDataSet::test_import_csv_no_header",
        "tests/dataset.py::TestDataSet::test_import_json",
        "tests/dataset.py::TestDataSet::test_insert",
        "tests/dataset.py::TestDataSet::test_introspect",
        "tests/dataset.py::TestDataSet::test_item_apis",
        "tests/dataset.py::TestDataSet::test_magic_methods",
        "tests/dataset.py::TestDataSet::test_model_kwargs_preserved",
        "tests/dataset.py::TestDataSet::test_pass_database",
        "tests/dataset.py::TestDataSet::test_self_referential_fk",
        "tests/dataset.py::TestDataSet::test_special_char_table",
        "tests/dataset.py::TestDataSet::test_table_column_creation",
        "tests/dataset.py::TestDataSet::test_table_column_creation_field_col",
        "tests/dataset.py::TestDataSet::test_table_thaw",
        "tests/dataset.py::TestDataSet::test_transactions",
        "tests/dataset.py::TestDataSet::test_update",
        "tests/dataset.py::TestDataSet::test_update_cache",
        "tests/dataset.py::TestDataSet::test_with_views",
        "tests/migrations.py::TestFKMigrationRegression::test_fk_migration",
        "tests/migrations.py::TestMigrationRunner::test_atomic_optout",
        "tests/migrations.py::TestMigrationRunner::test_create_scaffold",
        "tests/migrations.py::TestMigrationRunner::test_create_table_inline_model",
        "tests/migrations.py::TestMigrationRunner::test_down_missing_file",
        "tests/migrations.py::TestMigrationRunner::test_down_plan_requires_down",
        "tests/migrations.py::TestMigrationRunner::test_down_requires_down",
        "tests/migrations.py::TestMigrationRunner::test_down_series",
        "tests/migrations.py::TestMigrationRunner::test_down_target_validation",
        "tests/migrations.py::TestMigrationRunner::test_failed_migration",
        "tests/migrations.py::TestMigrationRunner::test_fake_target",
        "tests/migrations.py::TestMigrationRunner::test_numeric_ordering",
        "tests/migrations.py::TestMigrationRunner::test_run_convenience",
        "tests/migrations.py::TestMigrationRunner::test_runner_proxy",
        "tests/migrations.py::TestMigrationRunner::test_sqlite_rewrite_cascade_regression",
        "tests/migrations.py::TestMigrationRunner::test_status_missing_file",
        "tests/migrations.py::TestMigrationRunner::test_status_orphan_ordering",
        "tests/migrations.py::TestMigrationRunner::test_up_down_status"
      ],
      "timed_out": false,
      "network_isolated": true
    },
    "regression": {
      "exit_code": 1,
      "passed": 1252,
      "failed": 152,
      "errors": 0,
      "skipped": 144,
      "duration_s": 9.2,
      "failing_node_ids": [
        "tests/dataset.py::TestDataSet::test_case_insensitive",
        "tests/dataset.py::TestDataSet::test_column_preservation",
        "tests/dataset.py::TestDataSet::test_create_index",
        "tests/dataset.py::TestDataSet::test_creating_tables",
        "tests/dataset.py::TestDataSet::test_delete",
        "tests/dataset.py::TestDataSet::test_export",
        "tests/dataset.py::TestDataSet::test_find",
        "tests/dataset.py::TestDataSet::test_foreign_keys",
        "tests/dataset.py::TestDataSet::test_freeze_thaw",
        "tests/dataset.py::TestDataSet::test_freeze_thaw_csv_utf8",
        "tests/dataset.py::TestDataSet::test_freeze_thaw_datatypes_csv",
        "tests/dataset.py::TestDataSet::test_freeze_thaw_datatypes_json",
        "tests/dataset.py::TestDataSet::test_freeze_thaw_json_utf8",
        "tests/dataset.py::TestDataSet::test_freeze_thaw_nulls",
        "tests/dataset.py::TestDataSet::test_import_csv",
        "tests/dataset.py::TestDataSet::test_import_csv_no_header",
        "tests/dataset.py::TestDataSet::test_import_json",
        "tests/dataset.py::TestDataSet::test_insert",
        "tests/dataset.py::TestDataSet::test_introspect",
        "tests/dataset.py::TestDataSet::test_item_apis",
        "tests/dataset.py::TestDataSet::test_magic_methods",
        "tests/dataset.py::TestDataSet::test_model_kwargs_preserved",
        "tests/dataset.py::TestDataSet::test_pass_database",
        "tests/dataset.py::TestDataSet::test_self_referential_fk",
        "tests/dataset.py::TestDataSet::test_special_char_table",
        "tests/dataset.py::TestDataSet::test_table_column_creation",
        "tests/dataset.py::TestDataSet::test_table_column_creation_field_col",
        "tests/dataset.py::TestDataSet::test_table_thaw",
        "tests/dataset.py::TestDataSet::test_transactions",
        "tests/dataset.py::TestDataSet::test_update",
        "tests/dataset.py::TestDataSet::test_update_cache",
        "tests/dataset.py::TestDataSet::test_with_views",
        "tests/migrations.py::TestFKMigrationRegression::test_fk_migration",
        "tests/migrations.py::TestMigrationRunner::test_atomic_optout",
        "tests/migrations.py::TestMigrationRunner::test_create_scaffold",
        "tests/migrations.py::TestMigrationRunner::test_create_table_inline_model",
        "tests/migrations.py::TestMigrationRunner::test_down_missing_file",
        "tests/migrations.py::TestMigrationRunner::test_down_plan_requires_down",
        "tests/migrations.py::TestMigrationRunner::test_down_requires_down",
        "tests/migrations.py::TestMigrationRunner::test_down_series",
        "tests/migrations.py::TestMigrationRunner::test_down_target_validation",
        "tests/migrations.py::TestMigrationRunner::test_failed_migration",
        "tests/migrations.py::TestMigrationRunner::test_fake_target",
        "tests/migrations.py::TestMigrationRunner::test_numeric_ordering",
        "tests/migrations.py::TestMigrationRunner::test_run_convenience",
        "tests/migrations.py::TestMigrationRunner::test_runner_proxy",
        "tests/migrations.py::TestMigrationRunner::test_sqlite_rewrite_cascade_regression",
        "tests/migrations.py::TestMigrationRunner::test_status_missing_file",
        "tests/migrations.py::TestMigrationRunner::test_status_orphan_ordering",
        "tests/migrations.py::TestMigrationRunner::test_up_down_status"
      ],
      "timed_out": false,
      "network_isolated": true
    }
  },
  "cheat": {
    "clean": true,
    "critical_count": 0,
    "warning_count": 0,
    "signals": []
  },
  "quality": {
    "mi_before": 8.207,
    "mi_after": 25.406,
    "mi_delta": 17.199,
    "cc_mean_before": 3.045,
    "cc_mean_after": 2.487,
    "cc_mean_delta": -0.558,
    "files_analyzed": 4,
    "error": null
  },
  "cost": {
    "tokens_prompt": 3364762,
    "tokens_completion": 74976,
    "tokens_reasoning": 0,
    "tokens_total": 3439738,
    "cost_usd": 0.6213134,
    "llm_calls": 122,
    "byok_calls": 122,
    "tool_calls": 130,
    "wall_seconds": 3357.106
  },
  "process": {
    "turns": 120,
    "test_runs": 3,
    "tool_denials": 1,
    "errors": 0,
    "circuit_breaks": 2,
    "self_recoveries": 0,
    "stop_reason": "budget: max_turns (120 >= 120)"
  },
  "provenance": {
    "model": "qwen/qwen3-coder",
    "provider_requested": "DeepInfra",
    "providers_served": [
      "DeepInfra"
    ],
    "llm_seed": 20260822,
    "topology": "multi_agent_roles"
  },
  "diff": {
    "files_changed": 4,
    "insertions": 1184,
    "deletions": 2025,
    "changed_files": [
      "peewee.py",
      "peewee_test.db-shm",
      "playhouse/dataset.py",
      "playhouse/migrate.py",
      "playhouse/reflection.py"
    ]
  }
}
