{
  "result_schema_version": 2,
  "harness_version": "1.0.0",
  "evaluated_at": "2026-10-15T20:25:46+00:00",
  "run_id": "peewee-0002-orchestration-r02-a01",
  "arm": "orchestration",
  "task_id": "peewee-0002",
  "faixa": "media",
  "repetition": 2,
  "base_commit": "fc1811ecc1c55be8b1c4fd116c5d05c4ff7cf794",
  "resolved": false,
  "resolved_blocked_by_cheat": false,
  "oracle": {
    "f2p_total": 6,
    "f2p_passed": 0,
    "f2p": {
      "exit_code": 1,
      "passed": 0,
      "failed": 6,
      "errors": 0,
      "skipped": 0,
      "duration_s": 0.94,
      "failing_node_ids": [
        "tests/migrations.py::TestSchemaMigration::test_make_index_name_long",
        "tests/reflection.py::TestReflection::test_column_map_not_shared_with_class",
        "tests/sql.py::TestOnConflictSqlite::test_unbound_error",
        "tests/sql.py::TestWindowFunctions::test_duplicate_window_alias_error",
        "tests/transactions.py::TestTransaction::test_commit_rollback_closed",
        "tests/transactions.py::TestTransaction::test_mixing_manual_db_context"
      ],
      "timed_out": false,
      "network_isolated": true
    },
    "p2p": {
      "exit_code": 1,
      "passed": 802,
      "failed": 602,
      "errors": 2,
      "skipped": 144,
      "duration_s": 50.68,
      "failing_node_ids": [
        "tests/db_tests.py::TestDBProxy::test_proxy_context_manager",
        "tests/db_tests.py::TestDatabase::test_connect_semantics",
        "tests/db_tests.py::TestDatabase::test_context_managers",
        "tests/db_tests.py::TestDatabase::test_db_context_manager",
        "tests/db_tests.py::TestDatabase::test_explicit_connect",
        "tests/db_tests.py::TestIntrospection::test_get_columns",
        "tests/db_tests.py::TestIntrospection::test_get_columns_defaults",
        "tests/db_tests.py::TestIntrospection::test_get_columns_full_type",
        "tests/db_tests.py::TestIntrospection::test_get_foreign_keys",
        "tests/db_tests.py::TestIntrospection::test_get_foreign_keys_extended",
        "tests/db_tests.py::TestIntrospection::test_get_indexes",
        "tests/db_tests.py::TestIntrospection::test_get_indexes_sql",
        "tests/db_tests.py::TestIntrospection::test_get_primary_keys",
        "tests/db_tests.py::TestIntrospection::test_get_tables",
        "tests/db_tests.py::TestIntrospection::test_get_views",
        "tests/db_tests.py::TestIntrospection::test_quoted_name",
        "tests/db_tests.py::TestIntrospection::test_table_exists",
        "tests/db_tests.py::TestSessionTransactions::test_db_context_manager_nesting",
        "tests/db_tests.py::TestSessionTransactions::test_init_closes_open_connection",
        "tests/db_tests.py::TestSessionTransactions::test_session",
        "tests/db_tests.py::TestThreadSafeMetaRegression::test_thread_safe_meta",
        "tests/db_tests.py::TestThreadSafety::test_mt_general",
        "tests/db_tests.py::TestThreadSafety::test_multiple_readers",
        "tests/db_tests.py::TestThreadSafety::test_multiple_writers",
        "tests/db_tests.py::TestThreadSafety::test_thread_safe_false_uses_noop_lock",
        "tests/db_tests.py::TestThreadSafety::test_thread_safety_atomic",
        "tests/extra_fields.py::TestCompressedField::test_compressed_field",
        "tests/extra_fields.py::TestCompressedField::test_compressed_field_str",
        "tests/extra_fields.py::TestPickleField::test_pickle_field",
        "tests/fields.py::TestAutoField::test_autofield",
        "tests/fields.py::TestAutoField::test_autofield_primary_key_false_error",
        "tests/fields.py::TestBigAutoField::test_big_auto_field",
        "tests/fields.py::TestBitFields::test_bigbit_field",
        "tests/fields.py::TestBitFields::test_bigbit_field_bitwise",
        "tests/fields.py::TestBitFields::test_bigbit_field_bulk_create",
        "tests/fields.py::TestBitFields::test_bigbit_field_bulk_update",
        "tests/fields.py::TestBitFields::test_bigbit_field_instance_data",
        "tests/fields.py::TestBitFields::test_bigbit_field_null",
        "tests/fields.py::TestBitFields::test_bigbit_incompatible_data_error",
        "tests/fields.py::TestBitFields::test_bigbit_item_methods",
        "tests/fields.py::TestBitFields::test_bigbit_set_clear",
        "tests/fields.py::TestBitFields::test_bigbit_zero_idx",
        "tests/fields.py::TestBitFields::test_bit_field",
        "tests/fields.py::TestBitFields::test_bit_field_auto_flag",
        "tests/fields.py::TestBitFields::test_bit_field_instance_flags",
        "tests/fields.py::TestBitFields::test_bit_field_name",
        "tests/fields.py::TestBitFields::test_bit_field_subtract",
        "tests/fields.py::TestBitFields::test_bit_field_update",
        "tests/fields.py::TestBitFields::test_toggle_bit",
        "tests/fields.py::TestBlobField::test_blob_db_hook"
      ],
      "timed_out": false,
      "network_isolated": true
    },
    "regression": {
      "exit_code": 1,
      "passed": 802,
      "failed": 602,
      "errors": 2,
      "skipped": 144,
      "duration_s": 50.54,
      "failing_node_ids": [
        "tests/db_tests.py::TestDBProxy::test_proxy_context_manager",
        "tests/db_tests.py::TestDatabase::test_connect_semantics",
        "tests/db_tests.py::TestDatabase::test_context_managers",
        "tests/db_tests.py::TestDatabase::test_db_context_manager",
        "tests/db_tests.py::TestDatabase::test_explicit_connect",
        "tests/db_tests.py::TestIntrospection::test_get_columns",
        "tests/db_tests.py::TestIntrospection::test_get_columns_defaults",
        "tests/db_tests.py::TestIntrospection::test_get_columns_full_type",
        "tests/db_tests.py::TestIntrospection::test_get_foreign_keys",
        "tests/db_tests.py::TestIntrospection::test_get_foreign_keys_extended",
        "tests/db_tests.py::TestIntrospection::test_get_indexes",
        "tests/db_tests.py::TestIntrospection::test_get_indexes_sql",
        "tests/db_tests.py::TestIntrospection::test_get_primary_keys",
        "tests/db_tests.py::TestIntrospection::test_get_tables",
        "tests/db_tests.py::TestIntrospection::test_get_views",
        "tests/db_tests.py::TestIntrospection::test_quoted_name",
        "tests/db_tests.py::TestIntrospection::test_table_exists",
        "tests/db_tests.py::TestSessionTransactions::test_db_context_manager_nesting",
        "tests/db_tests.py::TestSessionTransactions::test_init_closes_open_connection",
        "tests/db_tests.py::TestSessionTransactions::test_session",
        "tests/db_tests.py::TestThreadSafeMetaRegression::test_thread_safe_meta",
        "tests/db_tests.py::TestThreadSafety::test_mt_general",
        "tests/db_tests.py::TestThreadSafety::test_multiple_readers",
        "tests/db_tests.py::TestThreadSafety::test_multiple_writers",
        "tests/db_tests.py::TestThreadSafety::test_thread_safe_false_uses_noop_lock",
        "tests/db_tests.py::TestThreadSafety::test_thread_safety_atomic",
        "tests/extra_fields.py::TestCompressedField::test_compressed_field",
        "tests/extra_fields.py::TestCompressedField::test_compressed_field_str",
        "tests/extra_fields.py::TestPickleField::test_pickle_field",
        "tests/fields.py::TestAutoField::test_autofield",
        "tests/fields.py::TestAutoField::test_autofield_primary_key_false_error",
        "tests/fields.py::TestBigAutoField::test_big_auto_field",
        "tests/fields.py::TestBitFields::test_bigbit_field",
        "tests/fields.py::TestBitFields::test_bigbit_field_bitwise",
        "tests/fields.py::TestBitFields::test_bigbit_field_bulk_create",
        "tests/fields.py::TestBitFields::test_bigbit_field_bulk_update",
        "tests/fields.py::TestBitFields::test_bigbit_field_instance_data",
        "tests/fields.py::TestBitFields::test_bigbit_field_null",
        "tests/fields.py::TestBitFields::test_bigbit_incompatible_data_error",
        "tests/fields.py::TestBitFields::test_bigbit_item_methods",
        "tests/fields.py::TestBitFields::test_bigbit_set_clear",
        "tests/fields.py::TestBitFields::test_bigbit_zero_idx",
        "tests/fields.py::TestBitFields::test_bit_field",
        "tests/fields.py::TestBitFields::test_bit_field_auto_flag",
        "tests/fields.py::TestBitFields::test_bit_field_instance_flags",
        "tests/fields.py::TestBitFields::test_bit_field_name",
        "tests/fields.py::TestBitFields::test_bit_field_subtract",
        "tests/fields.py::TestBitFields::test_bit_field_update",
        "tests/fields.py::TestBitFields::test_toggle_bit",
        "tests/fields.py::TestBlobField::test_blob_db_hook"
      ],
      "timed_out": false,
      "network_isolated": true
    }
  },
  "cheat": {
    "clean": true,
    "critical_count": 0,
    "warning_count": 0,
    "signals": []
  },
  "quality": {
    "mi_before": 0.0,
    "mi_after": 0.0,
    "mi_delta": 0.0,
    "cc_mean_before": 2.587,
    "cc_mean_after": 2.59,
    "cc_mean_delta": 0.003,
    "files_analyzed": 1,
    "error": null
  },
  "cost": {
    "tokens_prompt": 1267524,
    "tokens_completion": 16924,
    "tokens_reasoning": 0,
    "tokens_total": 1284448,
    "cost_usd": 0.1693028,
    "llm_calls": 128,
    "byok_calls": 128,
    "tool_calls": 145,
    "wall_seconds": 412.844
  },
  "process": {
    "turns": 120,
    "test_runs": 4,
    "tool_denials": 1,
    "errors": 0,
    "circuit_breaks": 2,
    "self_recoveries": 0,
    "stop_reason": "budget: max_turns (120 >= 120)"
  },
  "provenance": {
    "model": "qwen/qwen3-coder",
    "provider_requested": "DeepInfra",
    "providers_served": [
      "DeepInfra"
    ],
    "llm_seed": 20260822,
    "topology": "multi_agent_roles"
  },
  "diff": {
    "files_changed": 1,
    "insertions": 12,
    "deletions": 1,
    "changed_files": [
      "peewee.py",
      "peewee_test.db-shm",
      "temp_debug.py",
      "temp_debug2.py",
      "test_pooled.db"
    ]
  }
}
