{
  "result_schema_version": 2,
  "harness_version": "1.0.0",
  "evaluated_at": "2026-10-13T01:05:22+00:00",
  "run_id": "tomlkit-0002-orchestration-r03-a01",
  "arm": "orchestration",
  "task_id": "tomlkit-0002",
  "faixa": "grande",
  "repetition": 3,
  "base_commit": "b5da6c945aa00bf818f89d2fbd434bc3c2c949e2",
  "resolved": false,
  "resolved_blocked_by_cheat": false,
  "oracle": {
    "f2p_total": 1,
    "f2p_passed": 0,
    "f2p": {
      "exit_code": 1,
      "passed": 0,
      "failed": 1,
      "errors": 0,
      "skipped": 0,
      "duration_s": 0.26,
      "failing_node_ids": [
        "tests/test_api.py::test_add_dotted_key"
      ],
      "timed_out": false,
      "network_isolated": true
    },
    "p2p": {
      "exit_code": 1,
      "passed": 316,
      "failed": 428,
      "errors": 0,
      "skipped": 0,
      "duration_s": 4.17,
      "failing_node_ids": [
        "tests/test_api.py::test_a_raw_dict_can_be_dumped",
        "tests/test_api.py::test_add_dotted_key",
        "tests/test_api.py::test_build_super_table",
        "tests/test_api.py::test_dump_to_file_object",
        "tests/test_api.py::test_item_dict_to_table",
        "tests/test_api.py::test_item_mixed_aray",
        "tests/test_api.py::test_mapping_types_can_be_dumped",
        "tests/test_api.py::test_original_string_and_dumped_string_are_equal[0.5.0]",
        "tests/test_api.py::test_original_string_and_dumped_string_are_equal[example]",
        "tests/test_api.py::test_original_string_and_dumped_string_are_equal[fruit]",
        "tests/test_api.py::test_original_string_and_dumped_string_are_equal[hard]",
        "tests/test_api.py::test_original_string_and_dumped_string_are_equal[pyproject]",
        "tests/test_api.py::test_original_string_and_dumped_string_are_equal[sections_with_same_start]",
        "tests/test_api.py::test_original_string_and_dumped_string_are_equal[table_names]",
        "tests/test_api.py::test_original_string_and_dumped_string_are_equal[test]",
        "tests/test_api.py::test_parsed_document_are_properly_json_representable[0.5.0]",
        "tests/test_api.py::test_parsed_document_are_properly_json_representable[pyproject]",
        "tests/test_api.py::test_parsed_document_are_properly_json_representable[table_names]",
        "tests/test_build.py::test_add_remove",
        "tests/test_build.py::test_build_example",
        "tests/test_build.py::test_top_level_keys_are_put_at_the_root_of_the_document",
        "tests/test_items.py::test_append_dict_to_array",
        "tests/test_items.py::test_append_to_empty_array",
        "tests/test_items.py::test_array_behaves_like_a_list",
        "tests/test_items.py::test_array_multiline_modify",
        "tests/test_items.py::test_booleans_comparison",
        "tests/test_items.py::test_dates_behave_like_dates",
        "tests/test_items.py::test_datetimes_behave_like_datetimes",
        "tests/test_items.py::test_dicts_are_converted_to_tables",
        "tests/test_items.py::test_dicts_are_converted_to_tables_and_are_sorted_if_requested",
        "tests/test_items.py::test_dicts_are_converted_to_tables_and_keep_order",
        "tests/test_items.py::test_dicts_with_sub_dicts_are_properly_converted",
        "tests/test_items.py::test_floats_behave_like_floats",
        "tests/test_items.py::test_integers_behave_like_ints",
        "tests/test_items.py::test_item_array_of_dicts_converted_to_aot",
        "tests/test_items.py::test_items_are_pickable",
        "tests/test_items.py::test_items_can_be_appended_to_and_removed_from_a_table",
        "tests/test_items.py::test_items_can_be_appended_to_and_removed_from_an_inline_table",
        "tests/test_items.py::test_modify_array_with_comment",
        "tests/test_items.py::test_strings_behave_like_strs",
        "tests/test_items.py::test_table_copy",
        "tests/test_items.py::test_tables_behave_like_dicts",
        "tests/test_items.py::test_trim_comments_when_building_inline_table",
        "tests/test_toml_document.py::test_adding_an_element_to_existing_table_with_ws_remove_ws",
        "tests/test_toml_document.py::test_declare_sub_table_with_intermediate_table",
        "tests/test_toml_document.py::test_deepcopy",
        "tests/test_toml_document.py::test_document_is_a_dict",
        "tests/test_toml_document.py::test_document_with_new_sub_table_after_other_table",
        "tests/test_toml_document.py::test_document_with_new_sub_table_after_other_table_delete",
        "tests/test_toml_document.py::test_document_with_new_sub_table_after_other_table_replace"
      ],
      "timed_out": false,
      "network_isolated": true
    },
    "regression": {
      "exit_code": 1,
      "passed": 316,
      "failed": 428,
      "errors": 0,
      "skipped": 0,
      "duration_s": 4.72,
      "failing_node_ids": [
        "tests/test_api.py::test_a_raw_dict_can_be_dumped",
        "tests/test_api.py::test_add_dotted_key",
        "tests/test_api.py::test_build_super_table",
        "tests/test_api.py::test_dump_to_file_object",
        "tests/test_api.py::test_item_dict_to_table",
        "tests/test_api.py::test_item_mixed_aray",
        "tests/test_api.py::test_mapping_types_can_be_dumped",
        "tests/test_api.py::test_original_string_and_dumped_string_are_equal[0.5.0]",
        "tests/test_api.py::test_original_string_and_dumped_string_are_equal[example]",
        "tests/test_api.py::test_original_string_and_dumped_string_are_equal[fruit]",
        "tests/test_api.py::test_original_string_and_dumped_string_are_equal[hard]",
        "tests/test_api.py::test_original_string_and_dumped_string_are_equal[pyproject]",
        "tests/test_api.py::test_original_string_and_dumped_string_are_equal[sections_with_same_start]",
        "tests/test_api.py::test_original_string_and_dumped_string_are_equal[table_names]",
        "tests/test_api.py::test_original_string_and_dumped_string_are_equal[test]",
        "tests/test_api.py::test_parsed_document_are_properly_json_representable[0.5.0]",
        "tests/test_api.py::test_parsed_document_are_properly_json_representable[pyproject]",
        "tests/test_api.py::test_parsed_document_are_properly_json_representable[table_names]",
        "tests/test_build.py::test_add_remove",
        "tests/test_build.py::test_build_example",
        "tests/test_build.py::test_top_level_keys_are_put_at_the_root_of_the_document",
        "tests/test_items.py::test_append_dict_to_array",
        "tests/test_items.py::test_append_to_empty_array",
        "tests/test_items.py::test_array_behaves_like_a_list",
        "tests/test_items.py::test_array_multiline_modify",
        "tests/test_items.py::test_booleans_comparison",
        "tests/test_items.py::test_dates_behave_like_dates",
        "tests/test_items.py::test_datetimes_behave_like_datetimes",
        "tests/test_items.py::test_dicts_are_converted_to_tables",
        "tests/test_items.py::test_dicts_are_converted_to_tables_and_are_sorted_if_requested",
        "tests/test_items.py::test_dicts_are_converted_to_tables_and_keep_order",
        "tests/test_items.py::test_dicts_with_sub_dicts_are_properly_converted",
        "tests/test_items.py::test_floats_behave_like_floats",
        "tests/test_items.py::test_integers_behave_like_ints",
        "tests/test_items.py::test_item_array_of_dicts_converted_to_aot",
        "tests/test_items.py::test_items_are_pickable",
        "tests/test_items.py::test_items_can_be_appended_to_and_removed_from_a_table",
        "tests/test_items.py::test_items_can_be_appended_to_and_removed_from_an_inline_table",
        "tests/test_items.py::test_modify_array_with_comment",
        "tests/test_items.py::test_strings_behave_like_strs",
        "tests/test_items.py::test_table_copy",
        "tests/test_items.py::test_tables_behave_like_dicts",
        "tests/test_items.py::test_trim_comments_when_building_inline_table",
        "tests/test_toml_document.py::test_adding_an_element_to_existing_table_with_ws_remove_ws",
        "tests/test_toml_document.py::test_declare_sub_table_with_intermediate_table",
        "tests/test_toml_document.py::test_deepcopy",
        "tests/test_toml_document.py::test_document_is_a_dict",
        "tests/test_toml_document.py::test_document_with_new_sub_table_after_other_table",
        "tests/test_toml_document.py::test_document_with_new_sub_table_after_other_table_delete",
        "tests/test_toml_document.py::test_document_with_new_sub_table_after_other_table_replace"
      ],
      "timed_out": false,
      "network_isolated": true
    }
  },
  "cheat": {
    "clean": true,
    "critical_count": 0,
    "warning_count": 0,
    "signals": []
  },
  "quality": {
    "mi_before": 22.601,
    "mi_after": 28.469,
    "mi_delta": 5.868,
    "cc_mean_before": 2.831,
    "cc_mean_after": 2.814,
    "cc_mean_delta": -0.017,
    "files_analyzed": 3,
    "error": null
  },
  "cost": {
    "tokens_prompt": 2351108,
    "tokens_completion": 22667,
    "tokens_reasoning": 0,
    "tokens_total": 2373775,
    "cost_usd": 0.271881,
    "llm_calls": 121,
    "byok_calls": 121,
    "tool_calls": 120,
    "wall_seconds": 300.736
  },
  "process": {
    "turns": 120,
    "test_runs": 3,
    "tool_denials": 1,
    "errors": 0,
    "circuit_breaks": 2,
    "self_recoveries": 0,
    "stop_reason": "budget: max_turns (120 >= 120)"
  },
  "provenance": {
    "model": "qwen/qwen3-coder",
    "provider_requested": "DeepInfra",
    "providers_served": [
      "DeepInfra"
    ],
    "llm_seed": 20260823,
    "topology": "multi_agent_roles"
  },
  "diff": {
    "files_changed": 3,
    "insertions": 159,
    "deletions": 449,
    "changed_files": [
      "tomlkit/api.py",
      "tomlkit/container.py",
      "tomlkit/items.py",
      "tomlkit/out_of_order_table_proxy.py"
    ]
  }
}
