{
  "result_schema_version": 2,
  "harness_version": "1.0.0",
  "evaluated_at": "2026-10-13T16:19:34+00:00",
  "run_id": "peewee-0002-orchestration-r03-a01",
  "arm": "orchestration",
  "task_id": "peewee-0002",
  "faixa": "media",
  "repetition": 3,
  "base_commit": "fc1811ecc1c55be8b1c4fd116c5d05c4ff7cf794",
  "resolved": false,
  "resolved_blocked_by_cheat": false,
  "oracle": {
    "f2p_total": 6,
    "f2p_passed": 3,
    "f2p": {
      "exit_code": 1,
      "passed": 3,
      "failed": 3,
      "errors": 0,
      "skipped": 0,
      "duration_s": 0.38,
      "failing_node_ids": [
        "tests/migrations.py::TestSchemaMigration::test_make_index_name_long",
        "tests/reflection.py::TestReflection::test_column_map_not_shared_with_class",
        "tests/transactions.py::TestTransaction::test_mixing_manual_db_context"
      ],
      "timed_out": false,
      "network_isolated": true
    },
    "p2p": {
      "exit_code": 1,
      "passed": 1387,
      "failed": 17,
      "errors": 0,
      "skipped": 144,
      "duration_s": 6.13,
      "failing_node_ids": [
        "tests/migrations.py::TestSchemaMigration::test_make_index_name_long",
        "tests/reflection.py::TestReflection::test_column_map_not_shared_with_class",
        "tests/sql.py::TestInsertQuery::test_replace_sqlite",
        "tests/sql.py::TestOnConflictMySQL::test_ignore",
        "tests/sql.py::TestOnConflictMySQL::test_replace_mysql",
        "tests/sql.py::TestOnConflictMySQL::test_update",
        "tests/sql.py::TestOnConflictMySQL::test_update_use_value_mariadb",
        "tests/sql.py::TestOnConflictMySQL::test_where_not_supported",
        "tests/sql.py::TestOnConflictPostgresql::test_conflict_resolution_required",
        "tests/sql.py::TestOnConflictPostgresql::test_conflict_target_partial_index",
        "tests/sql.py::TestOnConflictPostgresql::test_conflict_target_required",
        "tests/sql.py::TestOnConflictPostgresql::test_ignore",
        "tests/sql.py::TestOnConflictPostgresql::test_update",
        "tests/sql.py::TestOnConflictSqlite::test_ignore",
        "tests/sql.py::TestOnConflictSqlite::test_replace_sqlite",
        "tests/sql.py::TestOnConflictSqlite::test_update_not_supported",
        "tests/transactions.py::TestTransaction::test_mixing_manual_db_context"
      ],
      "timed_out": false,
      "network_isolated": true
    },
    "regression": {
      "exit_code": 1,
      "passed": 1387,
      "failed": 17,
      "errors": 0,
      "skipped": 144,
      "duration_s": 6.15,
      "failing_node_ids": [
        "tests/migrations.py::TestSchemaMigration::test_make_index_name_long",
        "tests/reflection.py::TestReflection::test_column_map_not_shared_with_class",
        "tests/sql.py::TestInsertQuery::test_replace_sqlite",
        "tests/sql.py::TestOnConflictMySQL::test_ignore",
        "tests/sql.py::TestOnConflictMySQL::test_replace_mysql",
        "tests/sql.py::TestOnConflictMySQL::test_update",
        "tests/sql.py::TestOnConflictMySQL::test_update_use_value_mariadb",
        "tests/sql.py::TestOnConflictMySQL::test_where_not_supported",
        "tests/sql.py::TestOnConflictPostgresql::test_conflict_resolution_required",
        "tests/sql.py::TestOnConflictPostgresql::test_conflict_target_partial_index",
        "tests/sql.py::TestOnConflictPostgresql::test_conflict_target_required",
        "tests/sql.py::TestOnConflictPostgresql::test_ignore",
        "tests/sql.py::TestOnConflictPostgresql::test_update",
        "tests/sql.py::TestOnConflictSqlite::test_ignore",
        "tests/sql.py::TestOnConflictSqlite::test_replace_sqlite",
        "tests/sql.py::TestOnConflictSqlite::test_update_not_supported",
        "tests/transactions.py::TestTransaction::test_mixing_manual_db_context"
      ],
      "timed_out": false,
      "network_isolated": true
    }
  },
  "cheat": {
    "clean": true,
    "critical_count": 0,
    "warning_count": 0,
    "signals": []
  },
  "quality": {
    "mi_before": 7.485,
    "mi_after": 7.485,
    "mi_delta": 0.0,
    "cc_mean_before": 2.594,
    "cc_mean_after": 2.596,
    "cc_mean_delta": 0.002,
    "files_analyzed": 2,
    "error": null
  },
  "cost": {
    "tokens_prompt": 1078615,
    "tokens_completion": 9209,
    "tokens_reasoning": 0,
    "tokens_total": 1087824,
    "cost_usd": 0.1247903,
    "llm_calls": 123,
    "byok_calls": 123,
    "tool_calls": 120,
    "wall_seconds": 376.232
  },
  "process": {
    "turns": 120,
    "test_runs": 3,
    "tool_denials": 0,
    "errors": 0,
    "circuit_breaks": 2,
    "self_recoveries": 0,
    "stop_reason": "budget: max_turns (120 >= 120)"
  },
  "provenance": {
    "model": "qwen/qwen3-coder",
    "provider_requested": "DeepInfra",
    "providers_served": [
      "DeepInfra"
    ],
    "llm_seed": 20260823,
    "topology": "multi_agent_roles"
  },
  "diff": {
    "files_changed": 2,
    "insertions": 14,
    "deletions": 2,
    "changed_files": [
      "peewee.py",
      "peewee_test.db-shm",
      "playhouse/migrate.py"
    ]
  }
}
